{
  "$schema": "https://schemas.zenso.ink/v1/plugin-manifest.schema.json",
  "id": "zenso/plugin-starter",
  "thumbnail": "assets/logo.png",
  "schema_version": 1,
  "core_min": "0.0.0",
  "capabilities": [
    "script"
  ],
  "config_schema": {
    "type": "object",
    "required": [],
    "properties":{}
  }
}
